campaign_id,name,tags
40,F-15C The Georgian War Сampaign by Baltic Dragon,this campaign puts you in the role of a pilot who arrives in tbilisi as part of a small detachment intended to present the capabilities of the f-15c to the georgian government which has expressed interest in purchasing several airframes you and your colleagues are caught by surprise when armed conflict breaks out as the fighting escalates your small group is drawn into the war throughout the campaign's 16 missions the authors recreate some of the real-life events that happened between the 8th and 13th of august 2008 the fictionalized events presented in this campaign are based on extensive research from numerous western and russian publications interviews with people who were directly involved on both sides and several visits to the abl (administrative boundary line) with south ossetia the campaign aims to capture the pivotal moments of the 2008 war from a military perspective key features '16 story - driven missions with some factual events from the 2008 russo - georgian war in the background' 'historically - accurate descriptions of the situation on the ground and on the front line for the specific date and time when the mission takes place' 'extensive briefings based on real life fragos fragmentary orders as well as tactical maps' 'over 1500 custom voice-overs and thousands of triggers' english english
41,Spitfire LF Mk. IX Operation Epsom Campaign by B&W Campaigns,"fly the legendary spitfire lf mk ix over normandy in june 1944 as the allies attempt to break out of the d-day landing beachheads battle german forces in the air and on the ground as the allies push south over 12 missions south of the juno and gold landing beaches the missions consist of a combination of armed reconnaissance intercepts and directed ground attacks for this campaign we teamed up with the greatly respected ""bunyap"" who has created an amazing level of detail and content for the briefings and historical background all missions and flights in the campaign are based on actual missions down to the squadrons targets locations times weather flak locations etc we believe this will be the most historically accurate portrayal of world war ii air combat in a pc flight simulation key features '12 historic missions taken from detailed accounts of operation epsom' 'detailed briefing and briefing images including separate pdf mission files' 'unique kneeboard graphics for each mission' 'hundreds of specially recorded voice-over messages to recreate the actual callsigns and accents' 'a wide array of missions included armed reconnaissance intercepts and ground attack' 'takes advantage of new ai features like flak avoidance and authentic formations' english english russian"
42,A-10C Tactical Training Qualification Campaign by Maple Flag Missions,based on real world qualification requirements you will fly 15 performance check rides to execute against pre-defined performance objectives if successful you will rate a qualified rating and proceed to the next performance objective the campaign covers a number of key areas including fac & jtac coordination stationary and moving target tasking danger close tasking sead tasking deep interdiction tasking day & night and deep interdiction special forces coordination in addition you will work with additional cas assets and cover sadl datalink engagement cas mission management day & night battlefield air interdiction mission management day & night and combat search and rescue (csar) mission management day & night culminating in a final simulated combat mission using everything you have learned in the previous missions additionally 15 single player practice missions are provided so you can perfect your tactics techniques and procedures there are over 1300 voiceovers and over 470 pages of briefing material including the a-10c amplified checklist blue force in flight guide operation agile spirit spins maps target diagrams mission data cards and custom kneeboards english english
43,Mi-8MTV2 Oilfield Campaign by Dmitry Koshelev,"meet a group of old friends captain jury maksimovich protasov and his mi-8mtv2 crew after the events of the ""spring tension"" conflict they are again in business together however this time they are gainfully employed as cargo transportation contractors serving the interests of the oil industry rather than combat this campaign will test your knowledge of the mi-8mtv2 navigation suite in order to locate oil derricks scattered over the forests challenge yourself as a cargo pilot and never have to worry about being shot at again! crew moto ""not a day without drama!"" (с) crew chief andrey main features 'based on a real-life helicopter pilot missions' '16 full-scale missions' 'various cargos and mission task situations' 'landing in a different locations and weather conditions' 'over 350 scripted radio messages' 'voice overs for helicopter startup procedures' 'briefing with flight chart maps' 'flight charts are included pilot’s kneeboard' 'english and russian localization - voice overs and subtitles' english english"
44,UH-1H Argo Campaign by 373vFS Greg,"you and argo's crew have just sailed towards the black sea for the needs of nato ""sea breeze"" exercise nato is very cautious and takes extra protection measures since it is believed that small isil terrorist groups have infiltrated georgia by exploiting the refugee waves coming from turkey your huey’s performance in the exercise will define its future in the hellenic navy as military analysists doubt its competence in a modern naval environment the eyes of the whole fleet are on you and your chopper are you up for the task? ""argo"" campaign features '15 story-driven realistic missions' '+300 custom voiceovers' '+100 pages of detailed briefings maps & storyline' english english"
45,F-5E Aggressors Air Combat Maneuver Campaign by Maple Flag Missions,the f-5e aggressors acm campaign puts you in the cockpit of an f-5e tiger ii as a new aggressor pilot with the 65th aggressor squadron at nellis air force base based on real world procedures you will fly as red air against blue air forces you will face a series of challenging air combat maneuver (acm) missions against dis-similar aircraft your opponents include the f-4e f-5e f-14a f-15c f-15e f-16c f/a-18c m-2000c mig-29g cf-188 mig-21 and unknown additionally there are 11 single player practice missions with in-air starts so you can perfect your acm tactics and techniques 'there are over 1800 voiceovers and 49 pages of briefing material including the red flag spins red forces in flight guide' 'maps diagrams custom kneeboards and mission data cards' english english
46,A-10C Stone Shield Campaign,prepare yourself to face with the following tasks the a-10c stone shield campaign offers you a variety of challenging missions in which you must not only act as a tank killer but also operate as a sniper making one shot and one kill engagements 'providing precision airstrikes against enemy targets' 'supporting special ops teams in tracking down and capturing dangerous militants' 'providing on-call close air support for friendly forces and much more' english english
47,The Border Campaign by Armen Murazyan,"features of the border campaign '15 adventurous single player missions' ""206 voiced radio dialogues in the campaign's missions"" 'detailed mission briefings with flight plan pictures' 'russian localization includes voiceovers and subtitles' 'english localization includes subtitles' english english"
48,F-5E Aggressors Basic Fighter Maneuvers Campaign by Maple Flag Missions,the f-5e aggressors bfm campaign puts you in the cockpit of an f-5e tiger ii as a new aggressor pilot with the 65th aggressor squadron at nellis air force base based on real world procedures you will fly as red air against blue air forces upon arrival you will fly a familiarization flight around the nevada test and training range (nttr) then you will face a series of challenging basic fighter maneuver (bfm) missions against similar and dis-similar aircraft your opponents include the f-4e f-5e f-14a f-15c f-16c f/a-18c m-2000c mig-29g cf-188 and mig-21 'there are over 1000 voiceovers and over 45 pages of briefing material including the red flag spins red forces in flight guide' 'maps diagrams custom kneeboards and mission data cards' english english
49,A-10C Advanced Aircraft Training Qualification Campaign by Maple Flag Missions,based on real world qualification requirements you will fly 10 performance check rides to execute against pre-defined performance objectives if successful you will rate a qualified rating and proceed to the next performance objective 'the campaign covers a number of key areas including air to air refueling day and night countermeasures and threat avoidance target area ingress preparation illumination flare employment air to air gun and missile employment air to ground gun & rocket employment unguided and guided bomb employment and missile employment' 'there are over 1200 voiceovers and over 206 pages of briefing material including the a-10c amplified checklist maps target diagrams and mission data cards' 'additionally 10 practice missions are included so you can perfect your tactics techniques and procedures ttps prior to taking the qualification check rides' english english
50,A-10C Operation Piercing Fury Campaign by Ranger79,"operation piercing fury (opf) is a story driven campaign consisting of you leading a forwarded deployed a-10c warthog ""hawg"" flight in the georgian area of operations (ao) you will be assigned to and commanded by the joint special operations command providing direct support to conventional and non-conventional coalition forces in the region against al-doran and special purpose islamic army extremist groups your skills will be tested as you execute on-call close air support (cas) combat search and rescue assist in capture-or-kill missions and provide cas for air-assault raids by special forces teams throughout the region the campaign puts you directly into the action with many missions based off real-world scenarios operations and tactics opf enables you to experience the unique perspective of being in a combat zone based on realistic communications force protection forward operation bases combat outposts and insight from the campaign creator ranger79; a united states air force combat veteran of operation joint forge operation southern watch operation enduring freedom and operation iraqi freedom feel the adrenaline rush providing close air support in the ao! features of ""operation piercing fury"" '15 action-packed story driven missions' 'over 700+ custom voiceovers' '200+ pages of detailed operations orders / supporting documentation' english english"
51,The Museum Relic Campaign by Apache600,"features of ""the museum relic"" 'choose to fly the campaign as either the mig-15 or the f-86' '22 story driven missions which will push your abilities in high/low altitude and airspeed flight envelopes aerial gunnery ground attacks and navigation' 'each campaign has its own unique mission briefings flt plan pages and voice overs that coincide with the selected aircraft' 'over 160 pages of mission briefings and flt plan pages' 'also more than 400 custom voice overs by 17 different voice actors' 'custom made livery for both the mig-15 and the f-86' english english"
52,P-51D High Stakes Campaign by Dmitry Koshelev,in order to fully complete each mission and proceed to the next vasily will need to land his mustang at the assigned point at the conclusion of each mission additionally due to the plot of the story vasily will need to take care of his mustang and minimize damage to proceed through the story all of vasily's missions include detailed briefings and mission map graphics each mission also includes kneeboard briefing and map pages are you ready to join vasily on this epic journey? english english
53,A-10C Basic Flight Training Campaign by Maple Flag Missions,based on real world qualification requirements you will fly 12 performance check rides to execute against pre-defined performance objectives if successful you will rate a qualified rating and proceed to the next performance objective you will be rated on the following areas and these results will form your final rating the campaign covers a number of key areas including start-up and shutdown takeoffs and landings traffic patterns basic advanced and aerobatic maneuvers emergencies formation flying and instrument flight plan navigation there are over 2300 voiceovers and over 170 pages of briefing material including the a-10c amplified checklist maps diagrams and mission data cards 'general knowledge airmanship and safety' 'pre-takeoff and takeoff' 'navigation and maneuvers' 'approach landing and after landing' 'communications and task prioritization' english english
54,A-10C 16-2 Red Flag Campaign,"the a-10c 16-2 red flag campaign is a depiction of flying the a-10c ""warthog"" during a typical red flag exercise in the skies over nevada this campaign includes extensive briefing map and lineup card pdf files for each mission and was designed in consultation with the renowned author steve davies all of the missions are based on input from pilots that have flown in red flag exercises and will provide you a challenge that will test even the most skilled virtual pilots features for those that pre-purchased the nevada map and elected to receive this map for free you will now be able to activate this campaign from the dcs world 20 module manager '10 handcrafted mission that depict number of types of missions a a-10c pilot would fly in a red flag' 'highly detailed mission briefings mission maps and lineup cards as pdf files' 'custom voice overs and hundreds of triggers' 'created in partnership with the author steve davies and f-15c pilots that have flown red flags' english english"
55,F-15C 16-2 Red Flag Campaign,the f-15c 16-2 red flag campaign is a depiction of flying the f-15c eagle during a typical red flag exercise in the skies over nevada this campaign includes extensive briefing map and lineup card pdf files for each mission and was designed in consultation with the renowned author steve davies the authority on the f-15c all of the missions are based on input from real f-15c pilots that have flown in red flag exercises and will provide you a challenge that will test even the most skilled virtual pilots features for those that pre-purchased the nevada map and elected to receive this map for free you will now be able to activate this campaign from the dcs world 20 module manager '10 handcrafted mission that depict number of types of missions a f-15c pilot would fly in a red flag' 'highly detailed mission briefings mission maps and lineup cards as pdf files' 'custom voice overs and hundreds of triggers' 'created in partnership with the author steve davies and f-15c pilots that have flown red flags' english english
57,Black Shark 2 Republic Campaign,"features of the black shark 2 republic campaign requirements minimum system requirements (low graphics settings) os 64-bit windows 7/8/10; directx11; cpu intel core i3 at 28 ghz or amd fx; ram 8 gb (16 gb for heavy missions); free hard disk space 60 gb; discrete video card nvidia geforce gtx 760 / amd r9 280x or better; requires internet activation recommended system requirements (high graphics settings) os 64-bit windows 8/10; directx11; cpu core i5+ at 3+ ghz or amd fx / ryzen; ram 16 gb (32 gb for heavy missions); free hard disk space 120 gb on solid state drive (ssd); discrete video card nvidia geforce gtx 1070 / amd radeon rx vega 56 with 8gb vram or better; joystick; requires internet activation recommended vr systems requirements (vr graphics settings) os 64-bit windows 8/10; directx11; cpu core i5+ at 3+ ghz or amd fx / ryzen; ram 16 gb (32 gb for heavy missions); free hard disk space 120 gb on solid state drive (ssd); discrete video card nvidia geforce gtx 1080 / amd radeon rx vega 64 or better; joystick; requires internet activation this product can be downloaded and installed through the dcs world module manager if you do not have dcs world installed you can download the dcs world web-installer by clicking this link if the product description does not have information about which dcs world version you should install you only need to have the ""stable"" version dcs world installed on your pc requires dcs world version 2715 or above! raven one dominant fury campaign for the f/a-18c hornet is a prequel for the highly acclaimed raven one campaign based on the bestselling novel of the same title developed by baltic dragon all the missions were constructed with the active participation of author of the book kevin miller and vincent ""jell-o"" aiello host of the fighter pilot podcast - both retired us navy hornet pilots each with over 3000 career flight hours and numerous overseas deployments the campaign takes place 3 years before the events described in the novel during a deployment to the eastern mediterranean and offers a variety of different missions from training (faithfully recreating real life sorties flown from the deck of the aircraft carriers) through armed patrols and alert launches to power-projection striked '20 handmade missions with voice-overs' 'hundreds of complex triggers that create an interactive combat environment' 'fully detailed mission briefings and mission maps' 'storyline briefings' english english"
58,Su-27 The Ultimate Argument Campaign,"features of the campaign ""su-27 - the ultimate argument"" '20 storyline missions for a single player' 'more than 300 triggers which allow to create interactive environment' '126 voice-overs in the campaign missions' 'briefing’s art with maps' 'russian and english localizations voice-overs are recorded in russian in the english localization the voices are provided with english subtitles' english english"
