campaign_id,name,tags
19,F-14A Zone 5 Campaign by Reflected Simulations,dave 'bio' baranek entered the us navy in 1979 and enjoyed a successful and satisfying 20-year career with 2500 f-14 tomcat flight hours and 688 carrier landings he completed the legendary fighter tactics and weapons training program and later he returned as an instructor his logbook also records 450 flight hours in the f-5f tiger ii from his instructor tour he teamed up with reflected simulations to give dcs players a taste of air combat maneuvering training in the 1980s they created a digital syllabus that enables you to experience what it was like to be up there and train with the best light the cans shove it into zone 5 and let bio himself walk you through the action recorders on fight's on! key features '13 campaign missions' 'a wide array of realistic challenges of increasing difficulty based on real life training' 'over a thousand specially recorded voice-overs featuring the voice of jester ai' 'custom squadron paint schemes' 'briefings and debriefings written and read by bio himself' 'unique period correct kneeboard graphics for each mission' 'detailed briefings and briefing cards including separate pdfs for each mission' 'checklists and in-flight guides available in game as well as in pdf format' '3 instant action practice scenarios' english english
20,F-16C Red Flag 21-1 Campaign by Bunyap Campaigns,the red flag 21-1 campaign is the result of painstaking research on the conduct of modern large force exercises (lfe) scenarios procedures target sites and threats are based on those used in the real red flag take flight from nellis afb nevada in an f-16c viper to test your mettle against modern chinese hardware in a realistic combat training setting face off against the chinese j-11a flanker in a special one versus one basic fighter maneuvers (bfm) scenario these 10 missions will put you up against to some of the best military hardware in the world operated in the most realistic environment possible in a flight simulation key features '10 missions based on the actual red flag exercise with optional air start for faster mission completion/' 'detailed pdf mission briefings adapted from usaf standards' '20-page campaign guide and 50-page standard operating procedures document to walk you through the experience step by step' 'hundreds of authentic voice overs provide key information while in flight' english english
21,F-5E Black Sea Resolve '79 Campaign by SorelRo,"black sea resolve is a fictional story-based campaign that will test your air-to-air and air-to-ground skills in a variety of missions while you confront the soviet union forces in the emerging conflict it is the 1st of march 1979 your f-5e squadron is being deployed to krasnodar to support the un resolution for the independence of the former soviet union provinces in a rather moderate response us president jimmy carter and the other nato countries are deploying a force consisting of elements from 9th infantry division 6th cavalry air brigade and a mau from 1st marine division usaf is preparing 3 squadrons of f5-e and 2 squadrons of f4-e to provide air support campaign features '25 story-driven missions' 'over 300 voiceovers' ""late 1970's units set"" 'full-scale conflict that will progress throughout the campaign' 'a large variety of missions cap cas res-cap iron hand' 'detailed briefings kneeboard files and supporting documentation for each mission' english english"
22,"F/A-18C Operation Pontus Campaign by 373vFS Greg, 373vFS_Petritis, Baltic Dragon","""operation pontus"" is a story driven dynamic dlc campaign that puts you in the seat of the legendary f/a-18c hornet as the commanding officer (co) of the vfa-131 (aka ""wildcats”) you will have to plan design and execute various demanding missions for your squadron day and night with different weather conditions against an intelligent and adaptive enemy your ship uss george washington (cvn-73) has just anchored a few miles out of the georgian – turkish border and is ready to take action to put an end to a civil war that threatens to set the whole region on fire your decisions and performance will determine the progress of the campaign number of missions enemy activity allied morale and the final outcome of the war ""operation pontus” main campaign features ""every decision counts start' em up!” 'up to 30 missions total number is based on your success rate' 'dynamic briefings and sitreps' 'decision making and planning' 'over 1000 voiceovers creating a dynamic environment' english english"
23,Fw 190 A-8 Horrido! Campaign by Reflected Simulations,august 1944 you arrive to merville-calonne to take over the leadership of 7/jg26 flying focke wulf 190a-8s most of the pilots are mere teenagers with only a few flying hours and your job is to turn them into an efficient fighting unit under the ever-increasing pressures of the war the western-allies have gained complete air superiority over the continent and their ground forces are advancing rapidly through france experience the thrill of attacking large bomber formations head-on or the terror of taking off amid the bullets of low flying mustangs escort bombers to their target across the hazy channel or strafe enemy vehicles advancing relentlessly towards germany join the last of the jagdfliegers as they fight desperately day after day in the final months of the third reich key features '12 semi-historical missions focusing on jg26 in august 1944' 'detailed briefings and briefing images including separate pdf mission files' 'unique kneeboard cards and checklists for each mission' 'hundreds of specially recorded voice-over messages and radio broadcasts' 'german voices with english subtitles' 'historically accurate custom skins' 'a wide array of missions including patrol intercept bomber escort ground attack and more' english english
24,Mi-8MTV2 Crew Part 1 Campaign by Stone Sky,"and again you take over the seat of the commander of a mi-8mtv2 you are dmitry tarasov - a young pilot who climbs the career ladder and is faced with professional difficulties that your crew helps to overcome the adventure story of the crew campaign consists of two parts in the first part you have to perform the following tasks to pass the crew campaign you will need to know about how avionics radio and navigation equipment work the ability to conduct sustainable helicopter control in all stages of flight is required skills in handling engine and instrument failures will also be useful to you main features 'transport of vip-passengers on the mi-8mtv2 in the configuration ""salon""' 'work at gazprom-yuzhneft sites in the krasnodar territory' 'perform tasks in vfr and ifr' 'work on gazprom-arctic sites on the territory of the bolshevik island the severnaya zemlya archipelago implemented on the caucasus map' 'in combat missions you have to complete combat training flights with firing at ground targets' 'day and night flights' '14 story missions' '163 pages of detailed briefings and kneeboard' '1320 triggers' '1680 voiceovers' english russian english russian"
25,F/A-18C Raven One Сampaign by Baltic Dragon,"the raven one campaign for the f/a-18c hornet is based on the bestselling novel of the same title this campaign was developed with the active participation of author kevin miller and vincent ""jell-o"" aiello host of the fighter pilot podcast both are retired us navy hornet pilots each with over 3000 career flight hours and numerous overseas deployments the campaign faithfully recreates sorties from the book while adding additional ones related to the action for a total of 15 immersive fully voiced-over missions each script was carefully checked by kevin and vincent to ensure the most realistic experience available in dcs finally the campaign utilizes innovative solutions making in-game ai more responsive and predictive it will also have a limited save-game capability during the campaign gameplay as some missions may take two or more hours to complete features '15 story – driven missions' 'over 2200 recorded lines performed by over 50 voice actors' 'all main characters from the ""raven one"" novel' 'mission briefings supplementing and extending the ones described in the book written in close cooperation with kevin miller' 'highly detailed and realistic maps kneeboards and other documents based on real-life counterparts' 'all major types of missions cap cas sead ground and surface strikes alert – 7 and alert – 30 launches sea surface search control air interceptions and others' english english"
26,F/A-18C Hornet - The Serpent's Head 2 Campaign by Badger 633,"the ""serpents head 2"" is a 10 mission campaign for the f/a-18c hornet it comprises the next chapter of the previous 6 mission ""serpents head"" campaign already released and still available in the dcs user files as before it is a story-based campaign following the exploits of ""ford"" he is currently still stationed on the uss john c stennis the heart of the task force in the last campaign they had been sent to the black sea to address a regional conflict in this new campaign his flying skills and effective operation of the hornets weapons will be tested even further the campaign ethos as before is not to capture reality but create an imaginative enjoyable and engaging set of missions linked together with a plot narrative it has been designed with vr in mind including f10 menu items allowing coordinates given over the radio to be recalled back on screen it has taken many hours to complete over many months and includes over 400 actor voice files for these many thanks to ""reflected""""@alexander_dex"" and "" cdr ""curveball"" krotchety"" included are pdf briefs for each mission which should be read prior ""even as ""fords"" thoughts are homeward bound things are about to change in a way even he could not have anticipated"" english english"
27,F-86F Hunters over the Yalu Campaign by Reflected Simulations,"it's early 1953 after completing several tours in wwii you're yet again putting your neck on the line by flying dangerous combat missions over north korea command the 67th fighter bomber squadron attack enemy bridges factories strafe supply columns and support the us troops as they fight their fierce battles on the ground survive the heavy flak and fighter attacks then transfer to the legendary 39th fighter interceptor squadron to carry out large fighter sweeps in mig alley over the yalu river and tangle with massive bandit trains in the stratosphere watch out for the honchos they say casey jones is back in business! key features '12 realistic missions to be flown as the squadron leader of the 67th fbs and the 39th fis' 'sequel of the ""blue nosed bastards of bodney"" campaign although not mandatory' 'a detailed background story mission contexts and checklists' 'detailed briefings and briefing images including separate pdf mission descriptions' 'unique kneeboard graphics for each mission' 'over 300 custom recorded voice-over messages and radio broadcasts' 'historically accurate custom skins' 'a wide array of missions including cas bombing fighter sweep escort and scramble' english english"
28,UH-1H Worlds Apart - Spring 2025 Campaign by Low-Level-Heaven Mission Development,"a story-driven campaign consisting of you in the role of a german bell uh-1h helicopter pilot serving in the ""wolf pack"" squadron a unit of the german light aircraft group (heeresflieger) you are part of a four-person crew consisting of your commanding officer peter berger the two gunners hans and tom and you as the right seat pilot fly combined missions with your squadron leader wolf one and other helicopter and aircraft units missions are with other air and ground forces as well as naval units from different countries you will conduct transport missions as well as armed patrol and day and night combat missions in all weather conditions key features '12 challenging missions' 'more than 1400 voice overs' 'voice actors with an american german and russian accents' 'and more than 170 pages of detailed documentation' 'find mission-relevant information integrated into the kneeboard files' english english"
29,Bf 109 K-4 Jagdflieger Campaign by Reflected Simulations,"it's march 1944 the beginning of the end the reich has become a fortress without a roof the large formations of allied four motors have become daily visitors come join the german luftwaffe in these dire times jump into one of jg26's messerschmitt bf-109-s and find out what it’s like to attack the ""fat cats"" head on or to take off in a hail of bullets from the attacking mustangs watch the allied forces land on the beaches of normandy and support the retreating wehrmacht let all the details immerse you in this semi-historical campaign and make you feel like a young jagdflieger fighting a lost battle where like 1944 survival is the most you can hope for key features '12 semi-historical missions focusing on jg26 from march to july 1944' 'a detailed background story mission contexts and checklists' 'detailed briefings and briefing images including separate pdf mission files' 'unique kneeboard graphics for each mission' 'over 250 specially recorded voice-over messages and radio broadcasts' 'historically accurate custom skins' 'a wide array of missions including free hunt intercept bomber escort and ground attack' english english"
30,F/A-18C Aggressors BFM Campaign by Maple Flag Missions,"the f/a-18c aggressors bfm campaign puts you in the cockpit of an fa-18c hornet as a new aggressor pilot with vfc-12 the ""fighting omars"" on loan to the 65th aggressor squadron at nellis air force base based on real world procedures you will fly as red air against blue air forces upon arrival you will fly a familiarization flight around the nevada test and training range (nttr) then you will face a series of challenging basic fighter maneuver (bfm) missions against similar and dis-similar aircraft 'your opponents include the f-4e f-5e f-14a f-15c f-15e f-16c f/a-18c m-2000c mig-29g cf-188 mig-21 and su-27' 'additionally there are 12 single player practice missions with in-air starts so you can perfect your bfm tactics techniques and procedures' 'there are over 1000 voice-overs and over 45 pages of briefing material including the red flag spins red forces in flight guide maps diagrams custom knee-boards and mission data cards' english english"
31,The Enemy Within 3.0 Campaign by Baltic Dragon,"the enemy within 30 is a complete remake of the critically-acclaimed the enemy within campaign for the a-10c warthog this story-driven campaign puts you in cockpit of the warthog as part of a small 6-ship us detachment sent to georgia your mission is to help contain a growing threat from a terrorist organization calling itself the ""caucasus liberation army"" (cla) as the story unfolds you will be faced with a variety of challenges including close air support precision strikes combat search and rescue anti-ship strikes and even air to air combat striving to be as realistic as possible the units featured in the campaign are based on their real-life counterparts it also uses a sophisticated radio control system meaning that you must tune your on-board radios to the correct frequency to hear the more than 2000 custom voiceovers available throughout 21 missions compared to the original campaign version 30 offers following great additions and changes '20 out of 21 missions have been rewritten from scratch this includes the course of action dialogues briefings and background information' 'more than 2/3 of the missions take place in different locations than the original ones and most feature different challenges and enemies to provide a completely new experience 3 entirely new missions that are designed to complement and extend the storyline' 'the 8 pilot and 3 commander characters featured throughout the campaign have almost 4x more custom voiceovers over 2100' 'additional documents and custom kneeboard pages are available for each sortie' english english"
32,P-51D: The Blue Nosed Bastards of Bodney Campaign by Reflected Simulations,become a member of the most famous fighter unit of the usaaf take part in escorting large bomber formations support the ground troops after d-day or engage the luftwaffe over the snowy hills of the ardennes the blue nosed bastards of bodney is a semi-historical campaign for the p-51d mustang it follows the 352nd fighter group from may 1944 through the normandy landings until operation bodenplatte in january 1945 this campaign has a plethora of details and easter eggs to make you feel like a young american flyboy in the army air forces in 1944 key features for more information and support please visit to dedicated section of reflected simulations on the dcs forum '14 semi-historical missions focusing on the 352nd fighter group' 'a detailed background story mission contexts checklists and encounter reports' 'detailed briefings and briefing images including separate pdf mission files' 'unique kneeboard graphics and checklists for each mission' 'hundreds of specially recorded voice-over messages and radio broadcasts' 'historically accurate custom skins' 'a wide array of missions including fighter sweep bomber escort armed reconnaissance and ground attack' english english
33,Combined Arms: Frontlines Georgia Campaign,the combined arms frontlines georgia campaign is the first all combined arms single player campaign in this campaign you will experience many different aspects of combined arms combat in dcs world from commanding a large number of units over a number of different objectives to sitting in a tank and commanding a platoon of tanks from the driver's seat key features with ca frontlines we hope you will learn and enjoy playing dcs combined arms in ways you might not have ever thought about before '11 story driven missions with supplemental missions if you have a stumble along the way' 'command various ground units from armor to transport' 'freedom to set up your air units load-outs before the mission starts' '35+ unique voice overs' english english
34,Spitfire IX The Big Show Campaign by Reflected Simulations,put on pierre clostermann’s irvin jacket climb into his spitfire mkix and experience the massive air battles in the skies of western europe described in his similarly titled book this campaign follows clostermann’s career from april 1943 to july 1944 through 12 missions that recreate his memoirs down to the smallest details such as time weather squadrons and even radio transmissions find out what it feels like to fly with the biggin hill wing in a huge formation of spitfires to follow commandant mouchotte into gigantic melees against 30+ focke-wulfs to take part in rodeos circuses and attacks on v-1 launch sites or to support the ground troops after the d-day landings all clear? switches on! key features '12 historical missions following pierre clostermann during his time with 341 and 602 squadron' 'detailed briefings maps and briefing images including separate pdf mission files with historical backgrounds' 'unique kneeboard graphics and checklists for each mission' 'historically accurate custom skins' 'hundreds of specially recorded voice-over messages' 'a wide array of missions including fighter sweep bomber escort armed reconnaissance and ground attack' english english
35,Mi-8MTV2 and Ka-50: Memory of a Hero Campaign by Stone Sky,the memory of the hero campaign follows the story of helicopter pilot sergey pavlovich borisov being an honored sniper and research helicopter pilot and a hero of the soviet union and russia this campaign explores his experiences in the mi-8mtv2 and the ka-50 black shark the campaign is full of danger and exciting moments as you relive some of his more harrowing experiences! the campaign consists of more than 16 missions that include the action is told through a griping story narrative with an original soundtrack by the last haven 'work for a large siberian transport airline' 'transport workers and repair crews to oil deposits' 'take part in the abkhaz-georgian war of 1993 while flying the then-secret ka-50 attack helicopter' 'participate in intelligence gathering activities over georgian territory prior to the conflict in south ossetia do so in concert with the help of special fss equipment and direct support from the foreign intelligence service fis' 'perform ka-50 counter-terror operations in the southern caucasus region and along the georgian boarder' 'take part in rescue operations over the black sea in an mi-8mtv2' english russian english russian
36,M-2000C Red Flag Campaign by Baltic Dragon,"the m-2000c red flag campaign is a story-driven campaign that takes place during an extraordinary red flag exercise at the nevada test and training range (nttr) the campaign backstory revolves around growing hostilities between iran and its neighbors and a partially successful coup that takes place in the united arab emirates effectively splitting the country in two you will take on the role of a deputy commander of a 10-ship strong detachment of m-2000c interceptors from the 02005 fighter squadron ""île-de-france"" in preparation for war in the persian gulf your detachment and those from the united states germany the united kingdom poland and the netherlands will spend two weeks at the nttr to hone your skills all of the missions are based on extensive research of actual red flag exercises and will each include interesting facts and stories from previous runnings of the exercise features for more information and support please visit baltic dragon forums '16 story-driven missions' 'over 3000 voiceovers performed by more than 40 voice actors' 'returning characters from the m-2000c caucasus campaign' 'highly detailed mission briefings maps and other documents that includes air tasking orders and data sheets based on actual counterparts use by the us and french air forces' 'many of interesting background facts and stories from past red flag exercises' english english"
37,L-39 Albatros: Kursant Campaign,"the l-39 albatros kursant campaign is a single-player campaign for the l-39c/za aircraft you will learning basic and advanced points all flights are performed under the supervision of a virtual-instructor after each flight he will decide whether or not you progress to the next mission based on your performance at the conclusion to the training missions an evaluation flight will be performed to determine how well you have learned the skills of l-39 navigation and combat employment main features of this campaign 'low altitude navigation training' 'learning aerial reconnaissance using real-life tactics' 'detailed instruction on bomb rocket and gun weapon delivery against ground targets following realistic ingress maneuvers' 'interception of aerial targets with r-60 air-to-air missiles' '11 highly-detailed and realistic missions that are based on actual l-39 training requirements' 'missions start and end on the parking ramp which creates an immersive atmosphere of being a ""kursant"" cadet at the flight school' 'detailed briefings flight plans and virtual instructor pilot help you successfully complete this training course' english russian english russian"
38,F-15C Aggressors BFM Campaign by Maple Flag Missions,the f-15c aggressors bfm campaign puts you in the cockpit of an f-15c eagle as a new aggressor pilot with the 65th aggressor squadron at nellis air force base based on real world procedures you will fly as red air against blue air forces upon arrival you will fly a familiarization flight around the nevada test and training range (nttr) then you will face a series of challenging basic fighter maneuver (bfm) missions against similar and dis-similar aircraft your opponents include the f-4e f-14a f-15c f-15e f-16c f/a-18c m-2000c mig-29g cf-188 and mig-21 additionally there are 10 single player practice missions with in-air starts so you can perfect your bfm tactics techniques and procedures there are over 1000 voiceovers and over 45 pages of briefing material including the f-15c amplified checklist red flag spins red forces in flight guide maps diagrams custom kneeboards and mission data cards english english
39,P-51D Charnwood Campaign by B&W Campaigns,created by the same team behind the spitfire lf mkix epsom campaign the charnwood campaign is a historically-based campaign for the p-51d mustang over normandy in july 1944 the charnwood campaign reproduces p-51d missions flown in support of the allied breakout of normandy and the eventual capture of caen given the mustang’s combination of air-to-air and air-to-ground capabilities (bombs and rockets) this campaign offers a wealth of mission types and challenges each mission is based on a real missions down to the weather mission times squadrons mission tasks and allied and axis locations key features '12 historic missions taken from detailed accounts of operation charnwood' 'detailed briefing and briefing images including separate pdf mission files' 'unique kneeboard graphics for each mission' 'hundreds of specially recorded voice-over messages to recreate the actual callsigns and accents' 'a wide array of missions included armed reconnaissance rail interdiction and ground attack' 'takes advantage of new ai features like flak avoidance authentic formations and improve artificial intelligence for air and ground units' english english russian
